Conferencia,Ano,Edicao,Titulo,Resumo,Link
BRACIS,2024,2024: Anais da XXXIV Brazilian Conference on Intelligent Systems,Tuning Hypothesis Creation: Combining Discrete and Continuous Spaces for Zero-Shot Hate Speech Detection,"Hate speech detection is a crucial endeavor in maintaining the safety of online spaces, but the effectiveness of supervised approaches hinges mainly on the availability of annotated data. Prior research has explored the utility of natural language inference (NLI) models for zero-shot hate speech detection (ZSHSD), which leverages the capacity of these models to learn semantic relationships and adapt to downstream task without relying on large annotated datasets. NLI models assess if a premise sentence logically entails a hypothesis sentence, relying on precise hypothesis design to achieve adequate downstream task performance. Existing frameworks that use NLI model for ZSHSD rely on multiple inferences with different hypothesis to extract characteristics to achieve desirable outcomes. In light of the challenges surrounding ZSHSD and the method of relying on discrete tokens to design hypotheses, we aim to optimize and identify ideal intermediate representations by applying p-tuning techniques. On HateCheck, a fully tuned hypothesis led to a 18.8% point (pp) accuracy improvement, compared to a discrete designed hypothesis. Our work surpassed prior work by achieving a 5.6 pp accuracy enhancement, outperforming previous approaches that required multiple inferences. Also, the optimized tokens uncover relations to broader aspects of hate speech, offering insights for hypothesis design.",https://sol.sbc.org.br/index.php/bracis/article/view/33663
BRACIS,2024,2024: Anais da XXXIV Brazilian Conference on Intelligent Systems,Unsupervised Statistical Keyword Extraction Pipeline: Is LLM All You Need?,"Keyword extraction is an important step for text interpretation, serving to identify and highlight the most significant words or phrases within a text. This step is essential for various applications such as summarization, indexing, and information retrieval. This paper presents a custom-built keyword extraction pipeline named USKE (Unsupervised Statistical Keyword Extraction) and compares its performance to large language models (LLMs). USKE is able to deliver fast and simple results based in statistical methods even when dealing with large datasets. Our evaluation demonstrates that although LLMs can achieve good results in single sentences with minimal context, they require a lot of post-processing and may output inconsistent answers, while USKE excels in efficiency and scalability.",https://sol.sbc.org.br/index.php/bracis/article/view/33612
BRACIS,2024,2024: Anais da XXXIV Brazilian Conference on Intelligent Systems,Using Complex Networks to Improve Legal Text Hierarchical Classification,"Legal topics are typically organized into trees of labels, where each branch, from the root (generic topics) to the leaf (specific topics), categorizes the vocabulary that describe lawsuits. In this article, we describe an approach, innovative in the Brazilian Justice System, of automatic hierarchical classification of a petition topic. The approach integrates methods based on transformers and complex networks to capture, in addition to the characteristics of the text, the relationship between the legal citations present in the petitions and the topic to which the petition refers. The validation of this approach is done through a benchmark that shows accuracy gains, as well as, a practical scenario with the implementation of a microservice on a National Justice Platform whose front-end implementation is already being used by a State Court to automatically suggest the classification of the petitions topic in the National Procedural System.",https://sol.sbc.org.br/index.php/bracis/article/view/33613
BRACIS,2024,2024: Anais da XXXIV Brazilian Conference on Intelligent Systems,ptt5-v2: A Closer Look at Continued Pretraining of T5 Models for the Portuguese Language,"Despite advancements in Natural Language Processing (NLP) and the growing availability of pretrained models, the English language remains the primary focus of model development. Continued pretraining on language-specific corpora provides a practical solution for adapting models to other languages. However, the impact of different pretraining settings on downstream tasks remains underexplored. This work introduces ptt5-v2, investigating the continued pretraining of T5 models for Portuguese. We first develop a baseline set of settings and pretrain models with sizes up to 3B parameters. Finetuning on three Portuguese downstream tasks (ASSIN2 STS, ASSIN2 RTE, and TweetSentBR) yields SOTA results on the latter two. We then explore the effects of different pretraining configurations, including quality filters, optimization strategies, and multi-epoch pretraining. Perhaps surprisingly, their impact remains subtle compared to our baseline. We release ptt5-v2 pretrained checkpoints and finetuned MonoT5 rerankers on HuggingFace in their respective collections at https://huggingface.co/unicamp-dl .",https://sol.sbc.org.br/index.php/bracis/article/view/33603
BRACIS,2023,2023: Anais da XII Brazilian Conference on Intelligent Systems,A Clustering Validation Index Based on Semantic Description,"In clustering problems where the objective is not based on specifically spatial proximity, but rather on feature patterns and the semantic description, traditional internal cluster validation indices might not be appropriate. This article proposes a novel validity index to suggest the most appropriate number of clusters based on a semantic description of categorical databases. To assess our index, we also propose a synthetic data generator specifically designed for this type of application. We tested data sets with different configurations to assess the performance of the proposed index compared to well-known indices in the literature. Thus, we demonstrate that the index has great potential for discovering the number of clusters for the type of application studied and the data generator is able to produce relevant data sets for the internal validation process.",https://sol.sbc.org.br/index.php/bracis/article/view/28423
BRACIS,2023,2023: Anais da XII Brazilian Conference on Intelligent Systems,A Combinatorial Optimization Model and Polynomial Time Heuristic for a Problem of Finding Specific Structural Patterns in Networks,"The development of tools based on robust mathematical models to deal with real-world, computationally intractable problems has increasingly aligned with combinatorial optimization and integer linear programming techniques due to enormous technological advances and the real need to deal with large volumes of data. In this paper, the Maximum Tropical Path Problem on graphs (MTPP), which is known to be NP-hard, was investigated. It is a problem of searching for specific structural patterns in networks that can represent various applications, among them biological interactions, such as metabolic, neurological or protein interaction networks. The main result of this work consists of a polynomial-time heuristic algorithm that, according to experimental results, finds good solutions in practice. Furthermore, an integer linear programming model was developed and implemented so that it could be compared with the heuristic presented. To conclude, an empirical analysis was performed through computational experiments on both random and real-word instances to evaluate the results presented in this paper.",https://sol.sbc.org.br/index.php/bracis/article/view/28347
BRACIS,2023,2023: Anais da XII Brazilian Conference on Intelligent Systems,A Custom Bio-Inspired Algorithm for the Molecular Distance Geometry Problem,Protein structure allows for an understanding of its function and enables the evaluation of possible interactions with other proteins. The molecular distance geometry problem (MDGP) regards determining a molecule’s three-dimensional (3D) structure based on the known distances between some pairs of atoms. An important application consists in finding 3D protein arrangements through data obtained by nuclear magnetic resonance (NMR). This work presents a study concerning the discretized version of the MDGP and the viability of employing genetic algorithms (GAs) to look for optimal solutions. We present computational results for input instances whose sizes varied from 10 to 10 3 atoms. The results obtained show that approaches to solving the discrete version of the MDGP based on GAs are promising.,https://sol.sbc.org.br/index.php/bracis/article/view/28356
BRACIS,2023,2023: Anais da XII Brazilian Conference on Intelligent Systems,A Feature-Based Out-of-Distribution Detection Approach in Skin Lesion Classification,"When dealing with Deep Learning applications in open-set problems, accurately classifying known classes seen in the training phase is not the only aspect to be taken into account. In such a context, detecting Out-of-Distribution (OOD) samples plays an important role as an auxiliary task, generally solved by OOD detection methods. For medical applications, detecting unknown samples may in classification problems can be beneficial for many aspects, such as a better understanding of the diagnosis and probably a more adequate treatment. In this article, we evaluate a feature space-based approach, named as OpenPCS-Class, for OOD detection in medical applications, more specifically skin lesion classification. We compare the OpenPCS-Class against important OOD detection methods, evaluating different model architectures and OOD datasets. The OpenPCS-Class outperformed other methods at 48.4% and 5.3% in terms of FPR95 and AUROC, respectively.",https://sol.sbc.org.br/index.php/bracis/article/view/28397
BRACIS,2023,2023: Anais da XII Brazilian Conference on Intelligent Systems,A Framework for Characterizing What Makes an Instance Hard to Classify,"The health domain has been largely benefited by Machine Learning solutions, which can be used for building predictive models to support medical decisions. But, for increasing the reliability of these systems, it is important to understand when the models are prone to failures. In this paper, we investigate what can we learn from the instances of a dataset which are hard to classify by Machine Learning models. Different reasons may explain why one or a set of instances are misclassified, despite the predictive model used. They can be either noisy, anomalous or placed in overlapping regions, to name a few. Our framework works at two levels: the original base dataset and a meta-dataset built to reflect the hardness level of the instances. A two-dimensional hardness embedding is assembled, which can be visually inspected to determine sets of instances to scrutinize better. We show some analysis that can be undertaken in this hardness space that allow to characterize why some of the instances are hard to classify, with case studies on health datasets.",https://sol.sbc.org.br/index.php/bracis/article/view/28398
BRACIS,2023,2023: Anais da XII Brazilian Conference on Intelligent Systems,A Framework for Controversial Political Topics Identification Using Twitter Data,"Social networks have become the main stage for discussion on various current topics. In particular, electoral processes tend to bring many publications with polarized opinions on political issues addressed by candidates. A comprehensive analysis of social media publications on high-impact controversial topics and the opinions expressed in them could contribute to a clearer understanding of the dynamics of political discussion, providing valuable insights for society. In this context, we investigate how to apply a clustering-based topic modeling approach to produce public evaluation information on different current issues, in particular controversial political topics. We propose a framework that enriches text representations, combining state-of-the-art unsupervised (HDBSCAN) and supervised (BERTimbau) techniques to identify controversial political topics in social media publications in Brazilian Portuguese. To this end, weekly collections were carried out on the social network Twitter, making it possible to identify controversial events for each analyzed date. We compare the controversial topics uncovered with real-world news to validate the results and compare our method with a traditional method described in the literature.",https://sol.sbc.org.br/index.php/bracis/article/view/28421
BRACIS,2023,2023: Anais da XII Brazilian Conference on Intelligent Systems,A Monte Carlo Algorithm for Time-Constrained General Game Playing,"General Game Playing (GGP) is a challenging domain for AI agents, as it requires them to play diverse games without prior knowledge. In this paper, we develop a strategy to improve move suggestions in time-constrained GGP settings. This strategy consists of a hybrid version of UCT that combines Sequential Halving and UCB, favoring information acquisition in the root node, rather than overspend time on the most rewarding actions. Empirical evaluation using a GGP competition scheme from the Ludii framework shows that our strategy improves the average payoff over the entire competition set of games. Moreover, our agent makes better use of extended time budgets, when available.",https://sol.sbc.org.br/index.php/bracis/article/view/28351
BRACIS,2023,2023: Anais da XII Brazilian Conference on Intelligent Systems,A Multi-algorithm Approach to the Optimization of Thermal Power Plants Operation,"A new multi-algorithm approach for the daily optimization of thermal power plants and the Economic Dispatch was tested. For this, the dispatches were clustered in different groups based on their duration and the total power output requested. Genetic Algorithm, Differential Evolution and Simulated Annealing were selected for implementation and were employed according to the distinct characteristics of each dispatch. A monthly improvement of up to 2,45 x 10 5 R$ in the gross profit of the thermal power plant with the use of the optimization tool was estimated.",https://sol.sbc.org.br/index.php/bracis/article/view/28358
BRACIS,2023,2023: Anais da XII Brazilian Conference on Intelligent Systems,A Simple and Low-Cost Method for Leaf Surface Dimension Estimation Based on Digital Images,"The leaf is the organ of the plant body that performs photosynthesis and its area is one of the morphological parameters that most respond to droughts, climate changes, and attack of pathogens, associated with the accumulation of biomass and agricultural productivity. In addition, leaf area and other surface data (for example, width and length) are widely used in studies of plant anatomy and physiology. The methods of measuring these leaf surface parameters are often complicated and costly. In this context, this work aims to develop a simple and low-cost method capable of accurately measuring the leaf surface size of plant species with significant agricultural interest. Our method extract the information through images of leaves accompanied by a scale pattern whose real area is known, captured by a simple camera. To evaluate our method, we performed experiments with images of 118 leaves of 6 species. We compared the results to the ImageJ software, which is widely used to estimate leaf dimensions from images. The results showed our method present performance similar to ImageJ. However, unlike ImageJ, our method does not require user interaction during the dimensions estimation.",https://sol.sbc.org.br/index.php/bracis/article/view/28412
BRACIS,2023,2023: Anais da XII Brazilian Conference on Intelligent Systems,A Spin-off Version of Jason for IoT and Embedded Multi-Agent Systems,"Embedded artificial intelligence in IoT devices is presented as an option to reduce connectivity dependence, allowing decision-making directly at the edge computing layer. The Multi-agent Systems (MAS) embedded into IoT devices enables, in addition to the ability to perceive and act in the environment, new characteristics like pro-activity, deliberation, and collaboration capabilities to these devices. A few new frameworks and extensions enable the construction of agent-based IoT devices. However, no framework allows constructing them with hardware control, adaptability, and fault tolerance, besides agents’ communicability and mobility. This work presents an extension of the Jason framework for developing Embedded MAS with BDI agents capable of controlling hardware, communicating, and moving between IoT devices capable of dealing with fault tolerance. A case study of an IoT solution with a smart home, a monitoring center, and an autonomous vehicle is presented to demonstrate the framework’s applicability.",https://sol.sbc.org.br/index.php/bracis/article/view/28369
BRACIS,2023,2023: Anais da XII Brazilian Conference on Intelligent Systems,A Tool for Measuring Energy Consumption in Data Stream Mining,"Energy consumption reduction is an increasing trend in machine learning given its relevance in socio-ecological importance. Consequently, it is important to quantify how real-time learning algorithms tailored for data streams and edge computing behave in terms of accuracy, processing time, memory usage, and energy consumption. In this work, we bring forward a tool for measuring energy consumption in the Massive Online Analysis (MOA). First, we analyze the energy consumption rates obtained by our tool against a gold-standard hardware solution, thus showing the robustness of our approach. Next, we experimentally analyze classification algorithms under different validation protocols and concept drift and highlight how such classifiers behave under such conditions. Results show that our tools enable the identification of different classifiers’ energy consumption. In particular, it allows a better understanding of how energy consumption rates vary in drifting and non-drifting scenarios. Finally, given the insights obtained during experimentation on existing classifiers, we make our tool publicly available to the scientific community so that energy consumption is also accounted for in developing and comparing data stream mining algorithms.",https://sol.sbc.org.br/index.php/bracis/article/view/28430
BRACIS,2023,2023: Anais da XII Brazilian Conference on Intelligent Systems,Allocating Dynamic and Finite Resources to a Set of Known Tasks,"We consider a generalization of the task allocation problem. A finite number of human resources are dynamically available to try to accomplish tasks. For each assigned task, the resource can fail or complete it correctly. Each task must be completed a number of times, and each resource is available for an independent number of tasks. Resources, tasks, and the probability of a correct response are modeled using Item Response Theory. The task parameters are known, while the ability of the resources must be learned through the interaction between resources and tasks. We formalize such a problem and propose an algorithm combining shadow test replanning to plan under uncertain knowledge, aiming to allocate resources optimally to tasks while maximizing the number of completed tasks. In our simulations, we consider three scenarios that depend on knowledge of the ability of the resources to solve the tasks. Results are presented using real data from the Mathematics and its Technologies test of the Brazilian Baccalaureate Examination (ENEM).",https://sol.sbc.org.br/index.php/bracis/article/view/28357
BRACIS,2023,2023: Anais da XII Brazilian Conference on Intelligent Systems,An Explainable Model to Support the Decision About the Therapy Protocol for AML,"Acute Myeloid Leukemia (AML) is one of the most aggressive types of hematological neoplasm. To support the specialists’ decision about the appropriate therapy, patients with AML receive a prognostic of outcomes according to their cytogenetic and molecular characteristics, often divided into three risk categories: favorable, intermediate, and adverse. However, the current risk classification has known problems, such as the heterogeneity between patients of the same risk group and no clear definition of the intermediate risk category. Moreover, as most patients with AML receive an intermediate-risk classification, specialists often demand other tests and analyses, leading to delayed treatment and worsening of the patient’s clinical condition. This paper presents the data analysis and an explainable machine-learning model to support the decision about the most appropriate therapy protocol according to the patient’s survival prediction. In addition to the prediction model being explainable, the results obtained are promising and indicate that it is possible to use it to support the specialists’ decisions safely. Most importantly, the findings offered in this study have the potential to open new avenues of research toward better treatments and prognostic markers.",https://sol.sbc.org.br/index.php/bracis/article/view/28372
BRACIS,2023,2023: Anais da XII Brazilian Conference on Intelligent Systems,An Incremental MaxSAT-Based Model to Learn Interpretable and Balanced Classification Rules,"The increasing advancements in the field of machine learning have led to the development of numerous applications that effectively address a wide range of problems with accurate predictions. However, in certain cases, accuracy alone may not be sufficient. Many real-world problems also demand explanations and interpretability behind the predictions. One of the most popular interpretable models that are classification rules. This work aims to propose an incremental model for learning interpretable and balanced rules based on MaxSAT, called IMLIB. This new model was based on two other approaches, one based on SAT and the other on MaxSAT. The one based on SAT limits the size of each generated rule, making it possible to balance them. We suggest that such a set of rules seem more natural to be understood compared to a mixture of large and small rules. The approach based on MaxSAT, called IMLI, presents a technique to increase performance that involves learning a set of rules by incrementally applying the model in a dataset. Finally, IMLIB and IMLI are compared using diverse databases. IMLIB obtained results comparable to IMLI in terms of accuracy, generating more balanced rules with smaller sizes.",https://sol.sbc.org.br/index.php/bracis/article/view/28359
BRACIS,2023,2023: Anais da XII Brazilian Conference on Intelligent Systems,An Open Source Eye Gaze Tracker System to Perform Remote User Testing Evaluations,"Eye gaze trackers are devices designed to identify an individual’s gaze fixation in relation to a screen or another reference point. These tools are widely applied in usability testing as they provide various metrics for studying how people interact with applications. In the past, these tools were expensive and required a controlled environment, as well as trained personnel for proper operation. Although nowadays, new implementations do not require physical hardware to perform these tests, they often rely on license-based models instead of being open source. The objective of this work is to create a standalone system that enables any user to implement a low-cost eye gaze tracker using web technologies. The goal is to facilitate its use in remote and face-to-face studies in a simple way, requiring only a computer and a webcam. We evaluated the impact of three different calibration techniques on the performance of a regression-based prediction algorithm in eye-tracking. In our experiments, the best result of linear regression was obtained with a circular calibration system that uses 160 points. Furthermore, we integrated the system with a web interface and an API, enabling users to record their usability sessions and analyze fixation points through heatmaps.",https://sol.sbc.org.br/index.php/bracis/article/view/28415
BRACIS,2023,2023: Anais da XII Brazilian Conference on Intelligent Systems,Analyzing College Student Dropout Risk Prediction in Real Data Using Walk-Forward Validation,"College dropout is a concern for educational institutions since it directly impacts educational management and academic results, as well as being directly related to social problems. Therefore, there is significant incentive for studies that use data to support decisions by predicting risk of dropout so that institutions can attempt to prevent such cases. Although machine learning techniques were shown to have potential for this task, there are many steps involved when it comes to the use of real data, which comes from scattered systems and present issues such as need for data cleaning and preparation, high dimensionality of the data requiring adequate feature selection, as well as class imbalance. In this paper, we used data from 32.892 students enrolled between 2008 and 2020 from all courses offered by a public high-education institution. A protocol for data preparation is proposed and found to be more important than designing complex classifiers. We present guidelines when modelling a college dropout classification task using a public university data and experiments using Walk-Forward Validation that showed the predictive capacity for the first years.",https://sol.sbc.org.br/index.php/bracis/article/view/28363
