Conferencia,Ano,Edicao,Titulo,Resumo,Link
BRACIS,2025,2025: Anais da XXXV Brazilian Conference on Intelligent Systems,A Categorical Kalman Filter for Human Activity Recognition,"Human Activity Recognition (HAR) has gained increasing attention in recent years due to its wide range of applications in health, sports, and surveillance. The ubiquity and unobtrusive nature of inertial measurement unit (IMU) sensors in consumer devices have contributed to the growing popularity of IMU-based HAR systems. However, many existing models lack transparency in their decision-making processes—an essential aspect for both users and health professionals. In this work, we propose a human activity classifier based on the Kalman filter, designed to be interpretable and efficient using IMU data. We evaluate its performance on standard HAR datasets and compare it against classical benchmark classifiers such as logistic regression and support vector machines. Experimental results demonstrate that the proposed model offers a viable and competitive alternative for classifying human activities.",https://sol.sbc.org.br/index.php/bracis/article/view/40764
BRACIS,2025,2025: Anais da XXXV Brazilian Conference on Intelligent Systems,A Comparative Study of Machine Learning Models for Bee Flora Classification: Integrating Feature Extractors with Classifiers,"The bee flora refers to the group of plants from which bees collect floral resources, such as pollen, nectar, or both. The potential for beekeeping production in a region is influenced by its floral coverage. Therefore, understanding the foraging resources available to bees is essential for effectively managing and optimizing apiaries. We propose developing a computational model based on machine learning to classify flower images into three categories: pollen-producing, nectar-producing, or both. The objective is to provide insights about the beekeeping production potential of a specific region. The experiments utilized a dataset of 1,145 flower images from the beekeeping flora of the Sertão Central region in Ceará, Brazil. For feature extraction, ten Convolutional Neural Networks (CNNs) were employed, while classification was performed using Support Vector Machines (SVM), K-Nearest Neighbors (KNN), Multi-Layer Perceptron (MLP), and a CNN. The study aimed to identify the best combination of feature extractors and classifier methods. The results demonstrated the efficiency of the proposed approach, with the optimal combination being ResNet50 coupled with SVM, achieving a Matthews Correlation Coefficient (MCC) of 92.94%.",https://sol.sbc.org.br/index.php/bracis/article/view/40873
BRACIS,2025,2025: Anais da XXXV Brazilian Conference on Intelligent Systems,A Comprehensive Study of Fitness Landscapes in AutoML: The Impact of Dataset Complexity and Search Space Neutrality,"The search space in Automated Machine Learning (AutoML) consists of numerous combinations of machine learning pipelines. Understanding how optimal solutions are distributed within this space is key to improving search strategies and Fitness Landscape Analysis (FLA) provides useful tools for this purpose. However, traditional FLA metrics often fail to capture the complexity of AutoML tasks due to their high dimensionality and interdependencies. This study investigates the relationship between dataset complexity characteristics and FLA metrics in AutoML. While previous research has hinted at this connection, no comprehensive analysis has been presented. We focus on the concept of neutrality, which refers to regions where small pipeline configuration changes lead to minimal fitness changes. This property plays a critical role in the effectiveness of search algorithms. Our results reveal statistically significant correlations between neutrality and specific dataset complexity measures, particularly those related to class overlap and feature difficulty. These insights enhance the understanding of AutoML search space dynamics and support the development of more informed and adaptive optimization strategies.",https://sol.sbc.org.br/index.php/bracis/article/view/40765
BRACIS,2025,2025: Anais da XXXV Brazilian Conference on Intelligent Systems,A Double Transfer Learning Approach for Improving Canine Breast Cancer Detection Using VGG-16 on Histopathological Images,"Cancer is one of the most devastating health conditions worldwide, resulting from uncontrollable cell divisions that invade adjacent tissues and organs. Early detection is crucial to improving patients’ quality of life and, sometimes, enabling a cure. In this context, computer vision tools hold significant potential to expedite cancer diagnosis. This study proposes analyzing a double transfer learning approach using histopathological images, where the model is initially trained on ImageNet, followed by fine-tuning with BreaKHis pre-trained weights before applying it to veterinary images. The results indicate that double transfer learning improves model performance by approximately 5%, as observed in k-fold cross-validation with k = 5, highlighting the effectiveness of this approach in enhancing the accuracy and robustness of models for cancer diagnosis in veterinary imaging.",https://sol.sbc.org.br/index.php/bracis/article/view/40874
BRACIS,2025,2025: Anais da XXXV Brazilian Conference on Intelligent Systems,"A Fully Automatic Approach for COVID-19 Diagnosis in CT Imaging: Integrating Lung Segmentation, Fine-Tuning and Grad-CAM Visualization","The pandemic caused by the COVID-19 virus has highlighted the need for efficient and automated medical diagnostic tools to assist healthcare professionals in the fast and accurate identification of the disease. This study introduces a fully automatic approach for classifying COVID-19 in thoracic computed tomography (CT) images from the SARS-CoV-2 CT-scan dataset, employing deep learning, automatic lung segmentation, and fine-tuning models to the specific problem. Previous transfer learning experiments revealed that MobileNet emerged as the most effective architecture for feature extraction. Integrating Detectron2 for lung segmentation and subsequent fine-tuning of the selected MobileNet model significantly improved classification performance. Visual analysis of model interpretability using Grad-CAM demonstrated that with segmented images and the refined model, the network focused on lung regions, enhancing understanding of the model diagnosis. As a result, the proposed fully automatic method achieved superior evaluation metrics compared to other methods in the literature, reaching values of 99.60% for accuracy, precision, and F1-Score, along with 99.59% for recall and 99.20% for the Matthews Correlation Coefficient (MCC).",https://sol.sbc.org.br/index.php/bracis/article/view/40846
BRACIS,2025,2025: Anais da XXXV Brazilian Conference on Intelligent Systems,A Generative Domain Adaptation Scheme for Swift Deployment of Parking Monitoring Systems,"Deep learning models have demonstrated remarkable accuracy in distinguishing between empty and occupied parking spaces when large amounts of annotated training data are available from the target environment. However, in real-world deployments, the major bottleneck lies in the labor-intensive annotation process required whenever a new scenario arises, or retraining is needed due to changes in the camera setup, often driven by maintenance, repositioning, or environmental conditions. This paper addresses this challenge by proposing a generative domain adaptation scheme designed to reduce annotation requirements and accelerate deployment significantly. Instead of relying on extensive labeled datasets and computationally expensive model retraining, our method synthesizes new training samples based on a small subset of instances from the target domain. In particular, by combining generative augmentation with a lightweight convolutional network for inference, our approach achieves a favorable balance between annotation cost, computational efficiency, and accuracy. These results highlight the method’s potential as a cost-effective and rapidly deployable solution for real-world parking lot monitoring. Under a cross-dataset evaluation protocol, we highlight that our approach achieves competitive accuracy (close to 97%) using as few as 256 labeled samples, thus substantially reducing human annotation effort without sacrificing classification performance.",https://sol.sbc.org.br/index.php/bracis/article/view/40766
BRACIS,2025,2025: Anais da XXXV Brazilian Conference on Intelligent Systems,A Livestock Monitoring System and Machine Learning Sequence Classification Comparison for Behavior Classification,"Timely disease diagnosis is essential for reducing livestock mortality, as delays caused by reliance on human visual inspection can lead to severe consequences. Early detection of illness hinges on access to detailed, individual animal data capable of capturing subtle behavioral and physiological changes before visible symptoms emerge. A robust classification system is therefore critical for automating behavior analysis, enabling prompt identification of deviations from normal patterns that may indicate illness and facilitating timely intervention. This work reports the development of an innovative livestock behavior classification and health monitoring device. The system incorporates a wireless neck collar equipped with motion and temperature sensors for continuous animal activity monitoring. A prototype collar was tested on two heifers in a controlled field setting under video surveillance. Collected data were manually annotated by human observers, classifying the heifers’ behaviors into five key categories: eating, drinking, walking, lying down, and standing. The study covers the entire process of creating the monitoring system, from the design and construction of the neck collar to data collection and annotation. It also details the complete data mining workflow, including data cleaning, pre-processing, and comparative analysis using six shallow Machine Learning (ML) algorithms. The results indicate that Gradient Tree Boosting is the best-performing model based on classification metrics appropriate for multiclass imbalanced data, such as the F1-score, Weighted F1-score, and Kappa coefficient. The designed device, integrated with a ML model, proved to be an effective and low-cost approach for classifying livestock behavior.",https://sol.sbc.org.br/index.php/bracis/article/view/40875
BRACIS,2025,2025: Anais da XXXV Brazilian Conference on Intelligent Systems,"A Multi-Dimensional Comparative Study of Generative Adversarial Networks, Diffusion Models, and Statistical Methods for Synthetic Health Data Generation","Synthetic data is increasingly important in privacy-sensitive or data-scarce domains such as healthcare, where access to real data is constrained by confidentiality or data availability challenges. This study compares three approaches for the generation of synthetic tabular health data: a statistical method (Gaussian Copula), an adversarial deep learning model (CTGAN), and an implementation of a diffusion-based technique called SimpleTableDiffusion. These methods represent different modeling paradigms: statistical, adversarial, and stochastic, each offering trade-offs in interpretability, flexibility, training stability, and privacy. We assess their performance across three dimensions: (i) statistical fidelity, that is, how well they replicate real data distributions; (ii) utility, measured by the effectiveness of classifiers trained on synthetic data and evaluated on real data; and (iii) privacy preservation, using a disclosure risk metric that estimates the likelihood of sensitive attribute inference. Our results show that CTGAN achieves the best overall performance, leading in utility, privacy, and marginal distribution quality. The Gaussian Copula excels at modeling conditional dependencies but lags in predictive tasks. The diffusion-based model performs competitively across metrics but falls short of the other generative models. This work establishes a unified benchmark, pointing towards hybrid approaches that leverage complementary strengths.",https://sol.sbc.org.br/index.php/bracis/article/view/40847
BRACIS,2025,2025: Anais da XXXV Brazilian Conference on Intelligent Systems,A Multidimensional Analysis of Swarm Dynamics in a Reinforcement Learning-Based Metaheuristic,"Traditional assessments of metaheuristics typically focus on performance metrics when solving benchmark problems, with limited attention to the underlying mechanisms that drive collective intelligence. This performance-centric approach fails to indicate why certain metaheuristics are successful in specific scenarios and provides minimal guidance for improving their design. To better understand these inner dynamics, we conducted a multidimensional analysis of the swarm dynamics in a Reinforcement Learning-based metaheuristic that can combine search behaviors from different Swarm Intelligence metaheuristics. Using Interaction Networks, Search Trajectory Networks, Improvement Frequency, and Population Turnover metrics simultaneously, we reveal how the RL approach dynamically switches between different swarm behaviors depending on the problem. Our results demonstrate that the RL-based metaheuristic matches the performance of the most effective specialised algorithm for each benchmark function by adaptively mimicking its social interaction patterns, search trajectories, and fitness development. We show that for the F1 function, the RL approach adopts behaviors similar to GWO, while for the F2 function, it transitions to GPSO-like patterns, aligning with the expected best-performing characteristics reported in the literature. This multidimensional approach provides insights into how adaptive metaheuristics combine different behaviours at optimisation stages, suggesting a pathway toward self-adaptive metaheuristics that automatically select optimal search strategies according to the simulation scenario.",https://sol.sbc.org.br/index.php/bracis/article/view/40767
BRACIS,2025,2025: Anais da XXXV Brazilian Conference on Intelligent Systems,A NAS-Optimized Deep Learning Model for Customer Churn Prediction in Financial Services,"Deep Learning (DL) methods offer competitive alternatives for Customer Churn Prediction (CPP) but are challenging to optimize due to their complexity. This study introduces STArS (Sequential Temporal Neural Architecture Search), a Genetic Algorithm-based Neural Architecture Search (NAS) method, to optimize Temporal Convolutional Neural Networks (TCNN) and Long Short-Term Memory (LSTM) models. The optimized STArS models outperform traditional models, such as Random Forest and XGBoost, as well as an empirically developed TCNN. The research also highlights the importance of feature analysis for retention strategies, using a real dataset from a financial services provider. This demonstrates the practical applicability of NAS techniques across multivariate time series datasets.",https://sol.sbc.org.br/index.php/bracis/article/view/40768
BRACIS,2025,2025: Anais da XXXV Brazilian Conference on Intelligent Systems,A New Approach for Obtain Reduced Sets in Least Squares Support Vector Machine: Lengthen via Levenberg-Marquardt,"In this work, a new approach for obtaining reduced sets for training least squares support vector machine (LSSVM) in binary classification tasks is presented. The methodology consists of carrying out a vector quantization procedure, forming clusters in the original feature space, subsequently it is determined which of the clusters presents greater heterogeneity, that is, which one presents more patterns of distinct classes. Starting from the premise that the patterns with the greatest chance of being support vectors are those closest to the decision boundary, the patterns from this cluster are used as candidates for initial support vectors and then the feature space is divided into the most heterogeneous cluster and its complementary. Then, using only complementary set, the LSSVM problem is formulated and solved iteratively via the Levenberg-Marquardt algorithm. This algorithm, in each iteration, considers the lagrange multipliers with the largest absolute values and transfer them from the complementary set to the most heterogenous one. This process continues until the stopping criterion is met. This results in a reduced set formed by the final support vectors for the LSSVM containing both the closest and furthest patterns from the decision boundary which carry great significance for the model. Numerical simulations are conducted to demonstrate the predictive capacity of the proposal, as well as its efficiency in terms of processing time.",https://sol.sbc.org.br/index.php/bracis/article/view/40769
BRACIS,2025,2025: Anais da XXXV Brazilian Conference on Intelligent Systems,A Note on Learning Algorithms as Approximations of Solomonoff Induction,"We present a theoretical result showing that a learning algorithm can be seen to be an approximation of Solomonoff induction. A constant multiplicative bound between the predictive probability of a learning algorithm and the Solomonoff semi-distribution characterises this approximation. Our main contribution is to state and prove this result concisely, in general, clarifying the theoretical role of algorithmic probability in practical learning. We also establish a positive correlation between the Vapnik Chervonenkis (VC) dimension of a model class and the Kolmogorov complexity of individual hypotheses within it, reinforcing the conceptual alignment between learnability and compressibility. We contextualise these findings by discussing implications on the MDL principle and the emergent behaviour of large language models (LLMs), which empirically approximate algorithmic prediction. An example and comparisons with PAC learning, Bayesian inference, and reinforcement learning are provided.",https://sol.sbc.org.br/index.php/bracis/article/view/40770
BRACIS,2025,2025: Anais da XXXV Brazilian Conference on Intelligent Systems,A Novel Interpretable Approach to Deep Multimodal Data Fusion Applied to Cancer Diagnosis,"The use of artificial intelligence (AI) in healthcare has seen significant growth, particularly in cancer diagnosis, which remains one of the leading causes of mortality globally. AI-based computer-aided diagnosis systems leveraging computer vision have explored multimodal data including images, text, and graphs, among others to improve diagnostic accuracy. However, many approaches, especially those involving middle fusion, are considered black-box models. Inspired by the clinical reasoning adopted by medical professionals, and aiming to develop a more interpretable approach based on deep multimodal fusion, this paper proposes a new hybrid approach. Firstly, the medical lesion image is classified using a convolutional neural network or transformer, generating a probability for one of the target classes. Next, this probability, combined with clinical and/or sociodemographic data, is used as input to an external classifier, which generates the final diagnostic. The proposed approach was evaluated: 1) on the skin cancer PAD-UFES-20 dataset consisting of clinical image and patient lesion information, and 2) on oral cancer NDB-UFES dataset consisting of histopathological images and sociodemographic data. On the one side, the obtained results indicate a slight inferior performance in terms of balanced accuracy compared to state-of-the-art using middle fusion, but on the other side our model provided interpretability using Shapley Additive Explanations (SHAP).",https://sol.sbc.org.br/index.php/bracis/article/view/40848
BRACIS,2025,2025: Anais da XXXV Brazilian Conference on Intelligent Systems,A Semantic Representation for the MIMIC-IV Database,"The exponential growth of data in public databases, such as GenBank, underscores the need to consolidate information from multiple sources and formats. The diverse strategies adopted by each database create heterogeneities in schemas, file formats, and identifiers, making direct and efficient integration challenging. The absence of a common semantic model for querying various independent biological databases has driven the community to develop biomedical ontologies. In this context, Knowledge Graphs emerge as a viable strategy to represent information in a semantically rich and organized manner, playing an essential role in overcoming integration and semantic interoperability challenges, enabling applications ranging from protein function identification to clinical applications. This work proposes the conception of a semantic representation for the MIMIC-IV database, aimed at creating its Knowledge Graph. This initiative seeks to integrate MIMIC-IV with other existing biomedical databases, facilitating discoveries and significant insights in the biomedical field. The project also addresses an existing gap in the literature regarding MIMIC-IV by providing a detailed analysis of its semantic representation and its application in biomedical research.",https://sol.sbc.org.br/index.php/bracis/article/view/40876
BRACIS,2025,2025: Anais da XXXV Brazilian Conference on Intelligent Systems,A Stacked Deep Learning-Based Method for Multiclass Classification of Sandstones in Microtomographic Images,"This study proposes a hybrid approach for the multiclass classification of micro-CT images of sandstones, aiming to support the automation of rock analysis in oil and gas applications, given that this process still heavily relies on manual analysis by specialists, which can be time-consuming, subjective, and error-prone. The methodology was developed using the 11 Sandstones: raw, filtered and segmented data dataset. Convolutional neural networks (DenseNet121, ResNet50, and VGG16) were trained individually, and their respective softmax outputs were weighted according to each model’s individual accuracy. The proposed method constitutes a stacked model by integrating the weighted averaging strategy with a multilayer perceptron (MLP). The results showed that the proposed approach outperformed both the individual models and simpler ensemble techniques, achieving up to 99% overall accuracy in the test evaluations. Furthermore, it proved effective in correcting errors observed in the other approaches, providing greater stability and robustness.",https://sol.sbc.org.br/index.php/bracis/article/view/40877
BRACIS,2025,2025: Anais da XXXV Brazilian Conference on Intelligent Systems,ADR Based on Fuzzy Logic with Dynamic Number of Uplink Transmissions Adjustment for LoRaWAN Networks in Mobility Scenarios,"Adaptive Data Rate (ADR) mechanisms are essential for optimizing communication performance and energy efficiency in LoRaWAN networks. However, traditional ADR schemes often struggle to adapt reliably to dynamic channel conditions, especially when devices are mobile. To address these challenges, this work introduces the Fuzzy ADR sensitive to the Coefficient of Variation with a Dynamic Transmission Window (FADR-CVM), a fuzzy-logic-based mechanism that applies robust normalization of the Signal-to-Noise Ratio (SNR), the link’s Coefficient of Variation (CV), and the variation in the number of measured SNR values–also inferred by the fuzzy system. Based on these factors, the mechanism dynamically adjusts the number of future uplink transmissions, infers changes to the spreading factor (SF) and transmit power (TP), and thus aims to boost data-delivery reliability and improve energy efficiency. The proposed mechanism was evaluated through simulations in the NS-3 tool, considering a 100 km area with up to 1000 randomly distributed end devices (EDs) operating either statically or under mobility. Experimental results show that the proposed solution improves the packet delivery ratio (PDR) by up to 10% and increases energy efficiency by up to 60 bits/J. These results highlight the potential of integrating fuzzy logic with dynamic transmission adjustments as an effective strategy for enabling more robust and energy-efficient communications in LoRaWAN networks.",https://sol.sbc.org.br/index.php/bracis/article/view/40878
BRACIS,2025,2025: Anais da XXXV Brazilian Conference on Intelligent Systems,AI Agents Powered by Open-Source Language Models for Causal Understanding in Portuguese,"Causal reasoning is a key capability for developing more robust, fair, and explainable AI agents. However, the ability of open-source Large Language Models (LLMs) to perform causal reasoning, especially in low-resource languages like Portuguese, remains a significant challenge. This paper introduces two AI agents powered by open-source LLMs: the Causal Classifier Agent and the Causal Judge Agent. For the fine-tuning of the Causal Classifier Agent, we leveraged an expanded version of the Golden Collection with a corpus of 2,500 natural language questions in Portuguese designed to support multilevel causal classification, combined with an enhanced Few-Shot Learning prompting strategy. The results demonstrate that, with targeted training and carefully designed prompts, smaller open-source LLMs can match or even outperform larger models in causal reasoning tasks. In the Causal Judge Agent project, we adopted an enhanced Few-Shot Learning approach and employed an open-source LLM to identify gaps and errors in the fine-tuning process of the first agent. This study highlights the potential of corpus-based fine-tuning and LLM-as-a-judge techniques as cost-effective strategies for improving causal reasoning capabilities in open LLMs.",https://sol.sbc.org.br/index.php/bracis/article/view/40773
