Conferencia,Ano,Edicao,Titulo,Resumo,Link
BRACIS,2025,2025: Anais da XXXV Brazilian Conference on Intelligent Systems,Improving Legislative Accessibility with Retrieval-Augmented Generation,"This study presents the design, development, and evaluation of a question-answering (Q&A) system based on the Retrieval-Augmented Generation (RAG) framework, aimed at improving public access to the legislative documents of Assembleia Legislativa do Estado do Rio Grande do Norte (Alern). The system integrates a vector-based document retrieval mechanism with large language models (LLMs) to enable users to submit natural language queries and receive relevant, accessible responses. It leverages embedding-based search to retrieve semantically relevant content and utilizes LLMs to generate clear answers. A comparative analysis of various embedding models – such as BGE-M3, ada-002, and GTE – was conducted to identify the most effective configuration for content retrieval. Results showed that BGE-M3 achieved the highest retrieval accuracy (96.86%) among the models tested. LLMs, including Llama 3.1 and DeepSeek-R1, were evaluated for response generation using BERTScore and human feedback. Llama 3.1 outperformed DeepSeek-R1 in coherence, grammar/spelling, and adequacy, achieving an average human evaluation score of 85.6%. Evaluation results, based on both synthetic datasets and human-curated questions, demonstrate the system’s potential to enhance legislative transparency and user engagement by facilitating accessible interaction with complex legal content.",https://sol.sbc.org.br/index.php/bracis/article/view/40862
BRACIS,2025,2025: Anais da XXXV Brazilian Conference on Intelligent Systems,Improving Medical Image Segmentation with Semantic Mask-Guided Diffusion Models,"Image segmentation plays a fundamental role in medical image analysis, especially in Computer-Aided Diagnosis (CAD) systems, by highlighting anatomical structures and assisting physicians in making accurate clinical decisions. Despite the remarkable success of deep learning-based segmentation models, their performance heavily relies on large and diverse annotated datasets, which are often limited in the medical domain due to the high cost and complexity of data acquisition and labeling. To address this limitation, this article proposes a data augmentation pipeline based on semantic mask-guided diffusion models, aiming to synthetically enhance medical image datasets with anatomically consistent samples. The proposed method was evaluated using annotated abdominal CT images from the MICCAI FLARE 2022 Challenge, employing the YOLO11 segmentation network to assess the impact of the augmented data. Experimental results show that the method improved segmentation performance, achieving an mAP@0.5 of 0.792 and an mAP@0.5:0.95 of 0.467, outperforming the baseline model trained solely on real data, which obtained 0.788 and 0.456, respectively. These findings highlight the effectiveness of diffusion-based augmentation in improving generalization and robustness of segmentation networks. Moreover, the results suggest that this strategy is particularly beneficial for segmenting larger and high-contrast anatomical structures, such as the liver and kidneys, which may guide future research toward structure-aware data synthesis techniques in medical imaging.",https://sol.sbc.org.br/index.php/bracis/article/view/40808
BRACIS,2025,2025: Anais da XXXV Brazilian Conference on Intelligent Systems,Increasing Time Series Forecasting Performance with Dynamic System Copula-Based Ensemble Models,"Time series forecasting has significantly benefited from ensemble models, which consistently outperform individual approaches by combining predictions from diverse methodologies. This paper proposes a novel ensemble framework based on the copula formalism, enabling dynamic selection of copula functions tailored to the characteristics of each dataset. Our approach integrates three widely recognized forecasting models: ARIMA, Multilayer Perceptron (MLP), and Long Short-Term Memory (LSTM) neural networks and applies them to five key financial time series: Petrobras, Google, Nasdaq, S&P500, and the GBT to USD exchange rate. The ensemble combines predictions using multiple copula functions and compares their performance against traditional ensemble methods, such as simple average, simple median, and MLP-based combination. Experimental results show that the proposed system achieves mean absolute percentage errors (MAPE) below 0.71, outperforming standard ensemble strategies. This improvement highlights the effectiveness of copula-based modeling as an adaptive and flexible tool for predictive fusion. We conclude that incorporating copula theory into ensemble learning brings substantial advancements in time series forecasting, as it allows dynamic model aggregation according to data behavior. The proposed method bridges statistical foundations and artificial intelligence, offering promising results in financial applications and potential for broader use across various forecasting domains.",https://sol.sbc.org.br/index.php/bracis/article/view/40809
BRACIS,2025,2025: Anais da XXXV Brazilian Conference on Intelligent Systems,Inference Time Debiasing Concepts in Diffusion Models,"We propose DeCoDi, a debiasing procedure for text-to-image diffusion-based models that changes the inference procedure, does not significantly change image quality, has negligible compute overhead, and can be applied in any diffusion-based image generation model. DeCoDi changes the diffusion process to avoid latent dimension regions of biased concepts. While most deep learning debiasing methods require complex or compute-intensive interventions, our method is designed to change only the inference procedure. Therefore, it is more accessible to a wide range of practitioners. We show the effectiveness of the method by debiasing for gender, ethnicity, and age for the concepts of nurse, firefighter, and CEO. Two distinct human evaluators manually inspect 1200 generated images. Their evaluation results provide evidence that our method is effective in mitigating biases based on gender, ethnicity, and age. We also show that an automatic bias evaluation performed by the GPT4o is not significantly statistically distinct from a human evaluation. Our evaluation shows promising results, with reliable levels of agreement between evaluators and more coverage of protected attributes. Our method has the potential to significantly improve the diversity of images it generates by diffusion-based text-to-image generative models.",https://sol.sbc.org.br/index.php/bracis/article/view/40810
BRACIS,2025,2025: Anais da XXXV Brazilian Conference on Intelligent Systems,Information Retrieval and In-Context Learning for Low-Resource Named Entity Recognition,"Autoregressive language models, when combined with In-Context Learning, have demonstrated strong performance across various tasks using limited labeled data. However, the application of this approach to Named Entity Recognition remains underexplored, partly due to the unique structural challenges inherent to the task. We propose a new technique for named entity recognition using autoregressive language models based on In-Context Learning and Information Retrieval techniques. Given an input text, models using this technique can fetch similar examples from a training set. These examples are then used to improve the language model’s ability to recognize named entities within the provided text. This approach is modular and independent of the underlying language model and the Information Retrieval technique. Experimental results indicate that this technique can be effective for low-resource applications, as in the CrossNER collection we achieve state-of-the-art performance with our proposed technique, showing that Information Retrieval can increase the F-score by as much as 11% points.",https://sol.sbc.org.br/index.php/bracis/article/view/40814
BRACIS,2025,2025: Anais da XXXV Brazilian Conference on Intelligent Systems,Integrating Explainable AI with Species Distribution Models to Assess Anthropogenic Impacts on Amazonian Birds,"The Amazon Rainforest, a critical hub of global biodiversity, faces increasing anthropogenic pressures, necessitating effective monitoring and conservation strategies. Species Distribution Models (SDMs) are vital tools for predicting habitat suitability, yet advanced machine learning-based SDMs, while accurate, often suffer from limited interpretability. This “black box” nature restricts ecological understanding and hinders the translation of model outputs into actionable conservation insights, a limitation evident in previous studies on Amazonian avifauna which primarily identified correlations without fully disentangling the influence of individual environmental drivers. This study overcomes these limitations by integrating Explainable Artificial Intelligence (XAI) techniques with SDMs to specifically assess the impacts of anthropogenic atmospheric pollutants on sensitive bird species from the Tyrannidae and Thraupidae families. We leverage unique, high-resolution atmospheric data (including aerosols and trace gases) from the GoAmazon 2014/15 campaign and apply SHapley Additive exPlanations (SHAP) to interpret a high-performing Support Vector Machine (SVM) model predicting bird occurrence. Our findings reveal that atmospheric pollutants strongly associated with human activity–notably methane, carbon monoxide, ozone, and acetonitrile–are among the most significant predictors of habitat suitability. SHAP analysis quantifies the complex, often non-linear contributions of these variables, demonstrating how specific pollutants drive habitat suitability predictions locally and globally. By enhancing SDM interpretability, this research provides transparent, ecologically meaningful insights into environmental stressors, offering a more robust tool to support evidence-based conservation planning for Amazonian biodiversity.",https://sol.sbc.org.br/index.php/bracis/article/view/40863
BRACIS,2025,2025: Anais da XXXV Brazilian Conference on Intelligent Systems,Interpolation of Multivariate Time Series with Nearly-Symmetric Time Translations,"Modeling complex systems from irregular multivariate time series (MTS), common in engineering and scientific domains, presents significant challenges due to asynchronous measurements, varying sampling rates, and missing data. Building upon architectures that explicitly handle temporal irregularities using time-informed recurrent units, this work introduces a refined approach that fundamentally decomposes the latent state update process. We propose separating the function responsible for incorporating new measurements from the function governing the temporal evolution of the hidden state. Specifically, the temporal translation over a given time delta is modeled using a dedicated transformation parameterized by a matrix constrained to be near-orthogonal. A separate ingestion function updates this time-evolved state with new measurement information when available. This explicit decomposition allows for a more principled representation of continuous-time dynamics, acting as a general regression framework applicable to both imputation and forecasting tasks. We demonstrate through experiments that our model is competitive with state-of-the-art techniques, while providing the desirable properties of near-orthogonal time translations.",https://sol.sbc.org.br/index.php/bracis/article/view/40811
BRACIS,2025,2025: Anais da XXXV Brazilian Conference on Intelligent Systems,Is Machine-Translation Enough? Understanding Impacts in LLM Benchmarking,"The Massive Multitask Language Understanding (MMLU) benchmark is widely employed to assess the general capabilities of Large Language Models (LLMs) across diverse domains. The predominance of English in training data and benchmark datasets introduces inherent limitations when extending assessments to a multilingual context. Portuguese results are often grouped within broad ’multilingual’ categories, preventing meaningful examination of model behavior and specific linguistic challenges. This study investigates the impact of English-to-Portuguese translation methods on MMLU performance, comparing: Google Translate, GPT-3.5, GPT-4o, and professional human translation. We evaluate three multilingual open-weight models and Sabiá 3, a state-of-the-art Portuguese-specialized model. Contrary to expectations, accuracy in machine-translated versions of MMLU is slightly higher than in the human-translated version. In a 95% confidence interval, the expected accuracy increase on GPT-4o’s translation is the highest, but still small, between 0.85% and 1.52%. We further evaluated these translation methods with standardized answer-order perturbations, while a slight decrease in accuracy was observed, the standard deviation among translation methods was 0.07%. The presented results support the trustworthiness of machine-translation for LLM benchmarking in Portuguese, providing a stepping stone for better performance evaluation through translated state-of-the-art benchmarks.",https://sol.sbc.org.br/index.php/bracis/article/view/40812
BRACIS,2025,2025: Anais da XXXV Brazilian Conference on Intelligent Systems,Isolated Sign Language Recognition in LIBRAS,"Hearing loss affects a significant part of the world population. Sign Language Recognition is the task of recognizing isolated signs in videos and has the potential to ease communication between Deaf and non-Deaf people. Data are vital to creating better Sign Language Recognition models. LIBRAS, the Brazilian Sign Language, still lags behind in terms of data availability in comparison to other Sign Languages, such as American and Russian. Our study aims to bridge this gap by introducing a novel LIBRAS dataset for Isolated Sign Language Recognition, MALTA-LIBRAS. This dataset is assembled from open online sources and can be used as a more diverse and representative test set than the previous available LIBRAS dataset, MINDS. We perform several experiments with three transformer-based video classification models for this task: VideoMAE, TimeSformer, and ViViT. Our findings show that action recognition pretraining substantially improves generalization beyond fine-tuning data distribution. Additionally, we identify a set of data augmentation strategies that further increase the model’s generalization to new conditions. In contrast to what could be expected, transferring knowledge from other sign languages does not yield significant improvements for LIBRAS.",https://sol.sbc.org.br/index.php/bracis/article/view/40864
BRACIS,2025,2025: Anais da XXXV Brazilian Conference on Intelligent Systems,Juru: Legal Brazilian Large Language Model from Reputable Sources,"The high compute cost associated with pretraining large language models limits their research. Two strategies have emerged to address this issue: domain specialization and pretraining with high-quality data. To explore these strategies, we specialized the Mistral-7B model with 1.9 billion unique tokens from reputable Brazilian legal sources and conducted few-shot evaluations on legal and general knowledge test suites. Our model, Juru, demonstrates the benefits of domain specialization by achieving improved performance on legal benchmarks, even with a reduced amount of pretraining data. However, this domain specialization through continued pretraining comes at the cost of increased forgetting in unrelated domains, as evidenced by performance degradation on general knowledge test suites in both Portuguese and English. This study contributes to the growing body of scientific evidence showing that pretraining data selection may enhance the performance of large language models, enabling the exploration of these models at a lower cost. Juru is publicly available at https://huggingface.co/roseval/Juru-7B .",https://sol.sbc.org.br/index.php/bracis/article/view/40813
BRACIS,2025,2025: Anais da XXXV Brazilian Conference on Intelligent Systems,Language Model Architectures for Behavioral Assessment: A Case Study on MAPER,"Professional profile mapping tests (PPMT) are used to improve employees’ skills in organizations. With the increase in demand, professionals who perform these tests often become overloaded and saturated. Large language models (LLMs) have proven to be, when properly applied, excellent support tools for generating reports and diagnostics in several areas. In this work, we apply, for the first time in the literature, a LLM to perform personalized PPMT feedbacks. To achieve our results: we built a real database containing (inputs and outputs) PPMT feedback information; we built an optimal prompt for the task; and we fine-tuned a LLM with our database plus prompt. Our research focused on two forms of fine-tuning: i.e., Low-Rank Adaptation (LoRA) and Retrieval Augmented Generation (RAG). We evaluate our approach using popular metrics such as rouge 1 and 2, rougeL and BERTScore. We also compared the models in terms of generation time and resource consumption. Our experiments have shown that the RAG approach, was capable of generating semantically accurate feedback with a BERTScore precision of around 76%, but tends to be syntactically different from the expected pattern (i.e., that of the psychologist). The LoRA approach was closer both semantically and syntactically to the psychologist’s patter with a BERTScore precision of 89%.",https://sol.sbc.org.br/index.php/bracis/article/view/40895
BRACIS,2025,2025: Anais da XXXV Brazilian Conference on Intelligent Systems,"Mapping the Landscape of Robotics for Autism Spectrum Disorder: A Scoping Review of Technologies, Applications, and Future Directions","This scoping review explores the use of robotic technologies as intervention tools for children with Autism Spectrum Disorder (ASD), an area of growing interdisciplinary interest. Following the PRISMA-ScR guidelines, we conducted a comprehensive search in the Scopus, IEEE Xplore, and ACM Digital Library databases for studies published between 2018 and 2025. From an initial set of 1167 publications, 27 articles met the inclusion criteria and were analyzed in detail. The results demonstrate a diverse range of robotic applications, with the NAO robot featured in 13 out of the 27 selected studies. Robotics interventions were primarily implemented in assistive therapy, social skills training, educational settings, and joint attention initiatives, predominantly targeting children aged 5 to 10 years. The volume of relevant publications peaked in 2020 and declined in subsequent years, highlighting both increased early momentum and the current need for renewed research efforts in this domain. Overall, the review identifies critical research gaps, particularly in terms of personalized and interdisciplinary intervention approaches. While robotic technologies show considerable promise in supporting autistic children, further high-quality studies are required to assess their long-term effectiveness and to inform the development of individualized, evidence-based practices.",https://sol.sbc.org.br/index.php/bracis/article/view/40865
BRACIS,2025,2025: Anais da XXXV Brazilian Conference on Intelligent Systems,MariNER: A Dataset for Historical Brazilian Portuguese Named Entity Recognition,"Named Entity Recognition (NER) is a fundamental Natural Language Processing (NLP) task that aims to identify and classify entity mentions in texts across different categories. While languages such as English possess a large number of high-quality resources for this task, Brazilian Portuguese still lacks in quantity of gold-standard NER datasets, especially when considering specific domains. Particularly, this paper considers the importance of NER for analyzing historical texts in the context of digital humanities. To address this gap, this work outlines the construction of MariNER: Mapeamento e Anotações de Registros hIstóricos para NER (Mapping and Annotation of Historical Records for NER), the first gold-standard dataset for early 20th-century Brazilian Portuguese, with more than 9,000 manually annotated sentences. We also assess and compare the performance of state-of-the-art NER models for the dataset.",https://sol.sbc.org.br/index.php/bracis/article/view/40897
BRACIS,2025,2025: Anais da XXXV Brazilian Conference on Intelligent Systems,"Maximum Dispersion, Maximum Concentration: Enhancing the Quality of MOP Solutions","Multi-objective optimization problems (MOPs) often require a trade-off between conflicting objectives, maximizing diversity and convergence in the objective space. This study presents an approach to improve the quality of MOP solutions by optimizing the dispersion in the decision space and the convergence in a specific region of the objective space. Our approach defines a Region of Interest (ROI) based on a cone representing the decision maker’s preferences in the objective space, while enhancing the dispersion of solutions in the decision space using a uniformity measure. Combining solution concentration in the objective space with dispersion in the decision space intensifies the search for Pareto-optimal solutions while increasing solution diversity. When combined, these characteristics improve the quality of solutions and avoid the bias caused by clustering solutions in a specific region of the decision space. Preliminary experiments suggest that this method enhances multi-objective optimization by generating solutions that effectively balance dispersion and concentration, thereby mitigating bias in the decision space.",https://sol.sbc.org.br/index.php/bracis/article/view/40815
BRACIS,2025,2025: Anais da XXXV Brazilian Conference on Intelligent Systems,Metaheuristic-Based Optimization for Cascaded Hydropower Systems,"This study presents a planning and optimization methodology for hydropower generation in run-of-river facilities. The research was applied to the Rio das Antas Energy Complex employing metaheuristic algorithms. This energy complex is composed of three hydropower plants with an installed capacity of 360 MW. The main objective is to improve the operation of these facilities, which is achieved through optimizing the use of available water resources. In order to attain this outcome, hydrological balance equations were applied, ensuring compliance with operational constraints while maximizing the plant’s generation efficiency. The study adopts three optimization algorithms: Particle Swarm Optimization (PSO), its variation Unified PSO (UPSO), and Differential Evolution (DE). The optimization process led to a significant improvement in the efficiency of the generating units of the power plants, surpassing the currently observed values by nearly 2%. This result demonstrates the effectiveness of the proposed approach in enhancing generation performance within the studied hydropower system. Additionally, the generating output recommended by the optimization algorithm was found to be consistent with both the scheduled dispatch and the historical generation patterns, which prioritize peak generation hours and result in fewer power unit shutdowns.",https://sol.sbc.org.br/index.php/bracis/article/view/40898
BRACIS,2025,2025: Anais da XXXV Brazilian Conference on Intelligent Systems,Mind the Gap: Investigating the Impact of Data Leakage on Machine Learning Predictive Models,"Data leakage is one of the most critical and underestimated threats to the validity of machine learning (ML) model evaluation, often leading to substantially inflated performance estimates. While the concept has been acknowledged in the literature, this is the first study to provide large-scale empirical evidence of its effects across diverse modeling scenarios. We systematically investigated the impact of data leakage introduced at four common pipeline stages – normalization, imputation, feature selection, and hyperparameter tuning – using 30 datasets and six supervised learning algorithms. Our results show that leakage significantly inflated performance in nearly half of the datasets (p < 5), with feature selection causing the strongest distortions. Support Vector Classifiers were particularly affected, showing large average gains and highly significant differences. Normalization and imputation led to minimal or statistically insignificant changes. These findings offer robust empirical evidence of how different leakage scenarios can distort model evaluation, underscoring the importance of rigorous pipeline design and validation practices in ML research and applications.",https://sol.sbc.org.br/index.php/bracis/article/view/40816
