Conferencia,Ano,Edicao,Titulo,Resumo,Link
BRACIS,2024,2024: Anais da XXXIV Brazilian Conference on Intelligent Systems,Anomalies Diagnostic in Endoscopic Images Using Deep Learning Ensemble Models,"Automated anomaly detection in medical images greatly benefits the medical community by assisting in the diagnosis and identification of clinical cases. This work focuses specifically on medical images obtained from endoscopies. We categorized the images into two classes: normal (including normal-cecum, normal-pylorus, normal-z-line) and abnormal (including dyed-lifted-polyps, dyed-resection-margins, esophagitis, polyps, ulcerative colitis). We propose data augmentation to balance the classes and deep learning model techniques for classification. We employed an Ensemble Voting method with deep learning models to enhance the accuracy of the process. Our results are robust, achieving an accuracy of 98.62%, a precision of 96.47%, a sensitivity of 99.64%, and an F1-score of 98.03%. This approach proves to be an effective tool for identifying anomalies in endoscopies. We believe our method can contribute to significant advancements in AI-assisted medical diagnostics.",https://sol.sbc.org.br/index.php/bracis/article/view/33621
BRACIS,2024,2024: Anais da XXXIV Brazilian Conference on Intelligent Systems,Applying Transformers for Anomaly Detection in Bus Trajectories,"Trajectory anomaly detection is essential in understanding traffic behavior, especially when external factors such as congestion, accidents, and poor weather conditions occur. Most of the previous approaches for this task highly rely on handcrafted features and physical trajectory characteristics, which can be costly to calculate in a large volume of data. In this paper, we propose a novel trajectory anomaly detection approach that relies on language modeling to learn well-formed GPS bus trajectories and, based on it, identifies anomalous trajectories and pinpoints their abnormal points (sub-trajectory anomaly detection). Our solution uses a deep generative encoder-decoder Transformer that learns relationships between the sequential points in the trajectories based on the self-attention mechanism. It does not require manual feature extraction and can be easily adapted to any type of trajectory (e.g., cars, people, and vessels). We have performed an extensive experimental evaluation that shows: (1) our approach is effective for both trajectory and sub-trajectory anomaly detection; and (2) it outperforms the baselines in most evaluation scenarios.",https://sol.sbc.org.br/index.php/bracis/article/view/33559
BRACIS,2024,2024: Anais da XXXIV Brazilian Conference on Intelligent Systems,Aroeira: A Curated Corpus for the Portuguese Language with a Large Number of Tokens,"The emphasis on constructing extensive datasets for training large language models (LLM) has recently increased, and current literature predominantly features datasets for high-resource languages such as English and Chinese. However, there is a notable scarcity of high-quality corpora for the Portuguese language. To address this limitation, we propose Aroeira, a curated corpus explicitly designed for training large language models in the Portuguese language, with a focus on the Brazilian Portuguese one. The Aroeira Corpus consists of 100 GB of texts from various internet platforms, processed through a comprehensive pipeline to ensure superior quality. The pipeline handles downloading, text extraction, language identification, application of quality and bias filters, and storage, all tailored for the Portuguese language. The resulting corpus contains 35.3 million documents and over 15.1 billion tokens, surpassing the largest previously available corpus in this domain.",https://sol.sbc.org.br/index.php/bracis/article/view/33560
BRACIS,2024,2024: Anais da XXXIV Brazilian Conference on Intelligent Systems,Assessing Adversarial Effects of Noise in Missing Data Imputation,"In real-world scenarios, a wide variety of datasets contain inconsistencies. One example of such inconsistency is missing data (MD), which refers to the absence of information in one or more variables. Missing imputation strategies emerged as a possible solution for addressing this problem, which can replace the missing values based on mean, median, or Machine Learning (ML) techniques. The performance of such strategies depends on multiple factors. One factor that influences the missing value imputation (MVI) methods is the presence of noisy instances, described as anything that obscures the relationship between the features of an instance and its class, having an adversarial effect. However, the interaction between MD and noisy instances has received little attention in the literature. This work fills this gap by investigating missing and noisy data interplay. Our experimental setup begins with generating missingness under the Missing Not at Random (MNAR) mechanism in a multivariate scenario and performing imputation using seven state-of-the-art MVI methods. Our methodology involves applying a noise filter before performing the imputation task and evaluating the quality of the imputation directly. Additionally, we measure the classification performance with the new estimates. This approach is applied to both synthetic data and 11 real-world datasets. The effects of noise filtering before imputation are evaluated. The results show that noise preprocessing before the imputation task improves the imputation quality and the classification performance for imputed datasets.",https://sol.sbc.org.br/index.php/bracis/article/view/33561
BRACIS,2024,2024: Anais da XXXIV Brazilian Conference on Intelligent Systems,Assessing European and Brazilian Portuguese LLMs for NER in Specialised Domains,"This paper discusses the impact of Portuguese variants in Large Language Models for the task of named entity recognition (NER) in specialised domains. The tests were made on a Brazilian Portuguese legal and a European Portuguese historical corpora. The models taken into account are BERTimbau (PT-BR), Albertina (PT-PT and PT-BR), and XML-R (multilingual). The impact was more evident in the Portuguese historical corpus, which resulted in higher F1 measures compared to previous works that did not consider the same language variant. Additionally, the study underscores the impact of model architecture on performance, highlighting the critical role of both linguistic alignment and model size in enhancing NER in specialised domains.",https://sol.sbc.org.br/index.php/bracis/article/view/33562
BRACIS,2024,2024: Anais da XXXIV Brazilian Conference on Intelligent Systems,Automated Segmentation of Computed Tomography Images for COVID-19 Patient Evaluation,"COVID-19, caused by SARS-COV-2, resulted in 774 million cases and 7 million deaths by March 2024. This study proposes an approach to detect pulmonary lesions in computed tomography scans, integrating classification, preprocessing, and segmentation. Initially, a model based on LeNet-5 classifies the relevant slices of the scans, eliminating the irrelevant ones. Subsequently, the selected images undergo contrast adjustments, binarization, and normalization. Afterwards, segmentation is performed using a U-Net-based architecture, allowing for detailed segmentation. The methodology achieved 78.40% Dice, 64.80% IoU, 78% Sensitivity, 100% Specificity, 89.60% AUC, and 81% Precision, using only 9 million parameters. These results offer a practical and efficient solution, supporting specialists in patient treatment.",https://sol.sbc.org.br/index.php/bracis/article/view/33622
BRACIS,2024,2024: Anais da XXXIV Brazilian Conference on Intelligent Systems,Automated and Intelligent Vocational Guidance System for Classifying Specialties Based on POSCOMP Microdata,"The National Examination for Admission to Postgraduate Studies in Computing (POSCOMP) is administered by the Brazilian Computer Society (SBC) to assess candidates’ knowledge for postgraduate programs in Computer Science in Brazil. Being one of the main evaluative instruments, the results of the POSCOMP exam, i.e., the database, can potentially obtain relevant patterns about the participants. In this sense, this article aims to propose an automated and intelligent vocational guidance system. This vocational system guides the participants to follow a research specialty based on the performance obtained in the exam. The proposed approach aims to support students in their academic decisions.",https://sol.sbc.org.br/index.php/bracis/article/view/33652
BRACIS,2024,2024: Anais da XXXIV Brazilian Conference on Intelligent Systems,Automatic Text Simplification for the Legal Domain in Brazilian Portuguese,"Legal and juridical documents such as rulings, laws, agreements, and contracts contain domain-specific terms and jargon, long and complex sentences that may be difficult to understand for laypeople without domain expertise, reading issues, or with a low education level. The simplification of these documents has been a concern for several years, aiming to democratize access to justice. Courts are already adopting simpler language, especially in documents aimed at laypeople, such as warrants and notifications, to enhance inclusion and clarity. Automatic textual simplification, a subfield of Natural Language Processing, seeks to make complex texts more accessible. This paper explores the task of automatic text simplification in Portuguese for the legal domain. The main challenge here is the lack of datasets containing complex sentences and their simplified versions. This work investigates how existing datasets, methods, and metrics used for text simplification perform applied to legal texts in Portuguese. We present qualitative and quantitative analyses using five models. The results show that GPT-based models have the best results, but fine-tuning with domain data is a viable open-source alternative.",https://sol.sbc.org.br/index.php/bracis/article/view/33648
BRACIS,2024,2024: Anais da XXXIV Brazilian Conference on Intelligent Systems,BASWE: Balanced Accuracy-Based Sliding Window Ensemble for Classification in Imbalanced Data Streams with Concept Drift,"In the wake of the exponential growth in data generation witnessed in recent decades, the binary classification task within data streams presents inherent challenges due to their continuous, real-time flow and dynamic nature. This paper introduces the Balanced Accuracy-based Sliding Window Ensemble (BASWE) algorithm that leverages Balanced Accuracy, sliding windows, and resampling techniques to effectively handle imbalanced classes and concept drifts, ensuring robust performance even as data patterns evolve. In experiments conducted on 40 datasets, comprising 16 real-world and 24 synthetic datasets generated under three configurations-no drift, gradual drift, and sudden drift-and with varying imbalance ratios, BASWE demonstrated superior performance compared to seven other state-of-the-art algorithms in terms of F1 Score and the Kappa statistic.",https://sol.sbc.org.br/index.php/bracis/article/view/33563
BRACIS,2024,2024: Anais da XXXIV Brazilian Conference on Intelligent Systems,Beyond Audio Signals: Generative Model-Based Speaker Diarization in Portuguese,"Speaker diarization, the task of automatically identifying different speakers in audio and video, is frequently performed using probabilistic models and deep learning techniques. However, existing methods usually rely on direct analysis of the audio signal, which presents challenges for languages that lack established diarization methodologies, such as Portuguese. In this article, we propose a new approach to speaker diarization that leverages generative models for automatic speaker identification in Portuguese. We employed two generative models: one for refining the transcribed audio and another for performing the diarization task, as well as a model for initially transcribing the audio. Our method simplifies the diarization process by capturing and analyzing speaker style patterns from transcribed audio and achieves high accuracy without depending on direct signal analysis. This approach not only increases the effectiveness of speaker identification but also extends the usefulness of generative models to new domains. It opens a new perspective for diarization research, especially for the development of accurate systems for under-researched languages in audio and video applications.",https://sol.sbc.org.br/index.php/bracis/article/view/33564
BRACIS,2024,2024: Anais da XXXIV Brazilian Conference on Intelligent Systems,Classification of Non-alcoholic Fatty Liver Disease in Thermal Images of the Liver Using a Siamese Neural Network,"Non-alcoholic fatty liver disease (NAFLD) is a prevalent and severe condition that requires effective and non-invasive diagnostic methods. This work presents an innovative approach using Siamese neural networks to classify thermal images of the liver in order to identify the presence of NAFLD. The research is motivated by the need to use artificial intelligence to analyze thermal images, especially when the number of images is limited, making it difficult for ordinary neural networks to learn, a difficulty that the Siamese network already faces with ease. The proposed method involves three stages: extraction of the region of interest (ROI), image pre-processing and classification using the Siamese Neural Network, which compares pairs of images to determine their similarity and, consequently, the presence or absence of NAFLD. The preliminary results, with an accuracy of 71%, precision of 57% and recall of 96%, indicate that this approach could offer a promising tool for the non-invasive diagnosis of NAFLD, contributing a promising method to the field of machine learning applied to medicine.",https://sol.sbc.org.br/index.php/bracis/article/view/33565
BRACIS,2024,2024: Anais da XXXIV Brazilian Conference on Intelligent Systems,Classifying Graphs of Elementary Mathematical Functions Using Convolutional Neural Networks,"The classification of images of elementary mathematical function graphs presents a significant challenge in computer vision; this is due to the varied shapes and formats of each functions curves. This classification is crucial for identifying function graphs, which have important applications in text and mathematical symbol recognition technologies, aiding visually impaired individuals by providing access to printed content. In educational environments, this identification helps obtain the analytical expression of drawn graphs, facilitating the extraction of information from educational materials. This article investigates various convolutional neural network (CNN) architectures to identify the most suitable model for classifying images of elementary mathematical function graphs. We compare our model with other renowned architectures, such as ResNet, MobileNet, and EfficientNet, using a custom dataset of function graphs. Our experiments show that the proposed architecture significantly outperforms networks of general purpose, achieving an accuracy of 98.51% in classifying elementary mathematical function graphs.",https://sol.sbc.org.br/index.php/bracis/article/view/33566
BRACIS,2024,2024: Anais da XXXIV Brazilian Conference on Intelligent Systems,Classifying Potentially Non-compliant Portuguese Language Sentences Concerning Privacy Policies,"Privacy policies (PPol) are extensive and contain complex sentences that are difficult to understand. They detail what happens with a person’s personal data and must comply with specific legislation. One way to assess the compliance of PPol with legislation is through machine learning models. There are some studies already carried out, aiming to detect compliance with the GDPR, basically analyzing PPol in English. In this work, we present a mapping of Brazilian data protection legislation into 27 categories, divided into 3 blocks, and 3 levels of potential compliance. We also introduced a corpus in Portuguese, with PPol sentences annotated through mapping of Brazilian legislation. We evaluated some classifier models in a task of detecting potentially non-compliant sentences and another task of categorizing potentially non-compliant sentences. We achieved performance close to the literature for studies in English and the GDPR. Our study points out ways to improve the automated assessment of PPol and highlights the complexity of the tasks that seek to ensure compliance with data protection legislation.",https://sol.sbc.org.br/index.php/bracis/article/view/33653
BRACIS,2024,2024: Anais da XXXIV Brazilian Conference on Intelligent Systems,Combining Clustering and Genetic Algorithms for Portfolio Optimization: A Case Study with B3 Companies,"Portfolio optimization has been addressed by optimization algorithms and due to the numerous local maxima, genetic algorithms have shown promise. Recent studies use these algorithms to optimize stock portfolios, whether as a multi-objective problem that maximize return and minimize risk or just as one objective problem, such as maximizing the Sharpe Ratio. In order to adapt these algorithms to the financial market, a new approach was developed that includes penalty and cardinality constraints. This study proposes an algorithm with two models of clustering of B3 companies with penalties and cardinality constraints. One model uses the clustering of companies by economic sector and the other model uses the clustering generated by the Kmeans-DTW time series clustering technique. Then the algorithm selects one asset per cluster of companies with the aim of diversifying the portfolio and reducing the correlation between assets, thus reducing the risk. Finally, the generated portfolios went through an optimization stage using a memetic genetic algorithm, which finds the best possible distribution that maximizes return and reduces risk.",https://sol.sbc.org.br/index.php/bracis/article/view/33623
BRACIS,2024,2024: Anais da XXXIV Brazilian Conference on Intelligent Systems,Comparative Analysis of Machine Learning Algorithms for Identifying Genetic Markers Linked to Alzheimer’s Disease,"The identification of genetic markers for complex diseases like Alzheimer’s Disease (AD) is pivotal in medical genomics. This study aims to identify genetic markers associated with AD by introducing a novel approach that exclusively utilizes genetic data. Our primary goals are to benchmark explainable machine learning models against BLUPF90, an advanced mixed linear model approach, and to uncover single nucleotide polymorphisms (SNPs) crucial for AD. We analyze SNPs to achieve these goals, focusing on the genetic heritability rate of 58–79% for AD [12]. Our methodology focuses solely on genetic data to uncover SNPs crucial for AD, employing transparent computational models to ensure interpretability alongside predictive power. The findings demonstrate the efficacy of a purely genomic approach combined with Machine Learning to advance our understanding of AD. Our methodology successfully identified a robust set of SNPs associated with AD, encompassing both previously recognized and novel SNPs. The Machine Learning models employed delineated distinct SNP profiles, highlighting the complexity and heterogeneity of AD. These results not only deepen our understanding of AD’s genetic underpinnings but also facilitate the development of targeted therapeutic and diagnostic strategies, showcasing the potential of computational techniques in medical genomics.",https://sol.sbc.org.br/index.php/bracis/article/view/33624
BRACIS,2024,2024: Anais da XXXIV Brazilian Conference on Intelligent Systems,Comparing Neural Network Encodings for Logic-Based Explainability,"Providing explanations for the outputs of artificial neural networks (ANNs) is crucial in many contexts, such as critical systems, data protection laws and handling adversarial examples. Logic-based methods can offer explanations with correctness guarantees, but face scalability challenges. Due to these issues, it is necessary to compare different encodings of ANNs into logical constraints, which are used in logic-based explainability. This work compares two encodings of ANNs: one has been used in the literature to provide explanations, while the other will be adapted for our context of explainability. Additionally, the second encoding uses fewer variables and constraints, thus, potentially enhancing efficiency. Experiments showed similar running times for computing explanations, but the adapted encoding performed up to 18% better in building logical constraints and up to 16% better in overall time.",https://sol.sbc.org.br/index.php/bracis/article/view/33567
BRACIS,2024,2024: Anais da XXXIV Brazilian Conference on Intelligent Systems,Damage Identification of Wind Turbine Blades,"Wind turbines capture the kinetic energy produced by the wind, with the blades being the component most susceptible to damage. Unplanned stops result in significant losses, which highlights the need to detect these failures early. As a step in the preventative maintenance procedure, hundreds of color photographs of the blades are taken for subsequent analysis by an expert. In this work, we present a method to highlight superficial damages in wind turbine blades using a classification and localization process. A new dataset was created using images of wind blades, each divided into uniform slices and labeled by an expert according to the type of fault identified. Then, we apply class balancing and data augmentation methods prior to fine-tuning a general-propose pre-trained deep convolutional neural network model. The best model was used to classify and locate damages in the wind blades images. As a result, we obtained an overall precision of 96.1%, accuracy of 97% and recall of 94.5% when classifying the presence of damages. We show that our method can be integrated into the monitoring of wind blade tasks, helping the specialist to highlight and identify images containing damage.",https://sol.sbc.org.br/index.php/bracis/article/view/33626
BRACIS,2024,2024: Anais da XXXIV Brazilian Conference on Intelligent Systems,Deep Learning Approach to Temporal Dimensionality Reduction of Volumetric Computed Tomography,"A common approach for analyzing medical images on volumetric data is to employ deep 2D convolutional neural networks (2D CNN) on each individual slice of the volume. This is largely attributed to the challenges posed by the nature of three-dimensional data: variable volume size, high GPU and RAM requirements, costly parameter optimization, etc. However, handling the individual slices independently in 2D CNNs deliberately discards the temporal information that is contained within the depth of the volumes, which tends to result in poor performance. In order to maintain temporal information, current solutions reduce the temporal dimensionality of the data using non-adaptive sampling processes, such as taking slices at given intervals or by means of interpolation. However, although this allows to keep some temporal information, it may discard important slices. In this paper, we propose a method based on GradCam to select meaningful slices in computed tomography volumes by evaluating the activation map to reduce temporal data dimensionality. Extensive experiments demonstrate the effectiveness of our method when compared to the current state of the art.",https://sol.sbc.org.br/index.php/bracis/article/view/33568
BRACIS,2024,2024: Anais da XXXIV Brazilian Conference on Intelligent Systems,Deployment of IBM Federated Learning Platform and Aggregation Algorithm Comparison: A Case Study Using the MNIST Dataset,"With the exponential growth in artificial intelligence, privacy and data acquisition concerns have surged, prompting stricter data protection laws. Federated Learning (FL) addresses these issues by enabling model training without accessing private data, allowing geographically dispersed clients to participate without sharing data. This study deployed an IBM FL platform using Docker containers across two clients and conducted training with the MNIST dataset using the two most common FL strategies: Federated Stochastic Gradient Descent (FedSGD) and Federated Averaging (FedAvg). The results validated the platform’s deployment and assessed the performance of each strategy in terms of model accuracy and client hardware capabilities. Performance metrics, including CPU and RAM usage, network traffic, and model accuracy, were collected. Despite the higher resource demands, both strategies achieved satisfactory model accuracy, with FedAvg showing slightly better efficiency for the small-scale deployment. The results emphasize the potential of FL for predictive maintenance in industrial applications, enabling decentralized data utilization while ensuring data privacy and security.",https://sol.sbc.org.br/index.php/bracis/article/view/33569
